Symbol,Name,Last Sale,Net Change,% Change,Market Cap,Country,IPO Year,Volume,Sector,Industry
CUZ,Cousins Properties Incorporated Common Stock,$36.11,-0.15,-0.414%,5367870988.00,United States,,672739,Consumer Services,Real Estate Investment Trusts
CVA,Covanta Holding Corporation Common Stock,$15.34,0.12,0.788%,2039803182.00,United States,,664308,,
CVE,Cenovus Energy Inc Common Stock,$7.90,-0.07,-0.878%,15937946450.00,Canada,,10932031,,
CVEO,Civeo Corporation (Canada) Common Shares,$17.01,0.51,3.091%,243121651.00,,2014,17696,,
CVI,CVR Energy Inc. Common Stock,$23.41,1.19,5.356%,2353421323.00,United States,2007,773347,Energy,Integrated oil Companies
CVII,Churchill Capital Corp VII Class A Common Stock,$9.86,-0.04,-0.404%,1700850000.00,,2021,198077,,
CVNA,Carvana Co. Class A Common Stock,$247.81,-15.64,-5.937%,42687984285.00,United States,2017,3583235,Consumer Services,Other Specialty Stores
CVS,CVS Health Corporation Common Stock,$85.11,1.41,1.685%,112053091501.00,United States,,8203846,Health Care,Managed Health Care
CVX,Chevron Corporation Common Stock,$110.02,1.00,0.917%,212125070874.00,United States,,10267618,Energy,Integrated oil Companies
CW,Curtiss-Wright Corporation Common Stock,$132.49,2.72,2.096%,5421346386.00,United States,,162815,Capital Goods,Industrial Machinery/Components
CWEN,Clearway Energy Inc. Class C Common Stock,$26.67,-0.67,-2.451%,5379690697.00,United States,2015,1165954,Public Utilities,Electric Utilities: Central
CWH,Camping World Holdings Inc. Class A Commom Stock,$46.34,1.40,3.115%,4102682289.00,United States,2016,828918,Capital Goods,Recreational Products/Toys
CWK,Cushman & Wakefield plc Ordinary Shares,$18.71,0.62,3.427%,4168673916.00,,2018,1546917,Finance,Real Estate
CWT,California Water Service Group Common Stock,$57.83,-0.09,-0.155%,2939788050.00,United States,,146039,Public Utilities,Water Supply
CX,Cemex S.A.B. de C.V. Sponsored ADR,$8.62,0.03,0.349%,12696372761.00,Mexico,,5735003,Capital Goods,Building Materials
CXE,MFS High Income Municipal Trust Common Stock,$5.51,0.07,1.287%,173683735.00,United States,1989,69467,,
CXH,MFS Investment Grade Municipal Trust Common Stock,$10.03,-0.04,-0.397%,91375757.00,United States,1989,13437,,
CXP,Columbia Property Trust Inc. Common Stock,$18.23,0.12,0.663%,2094064149.00,United States,2013,646615,Consumer Services,Real Estate Investment Trusts
CXW,CoreCivic Inc. Common Stock,$8.14,0.23,2.908%,979003449.00,United States,,1236473,Consumer Services,Real Estate Investment Trusts
CYD,China Yuchai International Limited Common Stock,$15.80,-0.16,-1.003%,645560982.00,Singapore,1994,5842,Capital Goods,Construction/Ag Equipment/Trucks
CYH,Community Health Systems Inc. Common Stock,$15.22,1.21,8.637%,2011163860.00,United States,2000,3986369,Health Care,Hospital/Nursing Management
D,Dominion Energy Inc. Common Stock,$78.45,-0.03,-0.038%,63271834238.00,United States,,2670770,Public Utilities,Electric Utilities: Central
DAC,Danaos Corporation Common Stock,$65.56,2.25,3.554%,1347869478.00,Greece,2006,435699,Transportation,Marine Transportation
DAL,Delta Air Lines Inc. Common Stock,$46.11,1.18,2.626%,29494117314.00,United States,,11189523,Transportation,Air Freight/Delivery Services
DAN,Dana Incorporated Common Stock ,$26.74,0.64,2.452%,3881133473.00,United States,,651611,Capital Goods,Auto Parts:O.E.M.
DAO,Youdao Inc. American Depositary Shares each representing one Class A Ordinary Share,$22.86,0.06,0.263%,2834204654.00,,2019,218916,Consumer Services,Other Consumer Services
DAR,Darling Ingredients Inc. Common Stock,$72.71,1.93,2.727%,11862753054.00,United States,,1075178,Consumer Non-Durables,Farming/Seeds/Milling
DASH,DoorDash Inc. Class A Common Stock,$124.89,2.12,1.727%,40685867277.00,,2020,1886965,Capital Goods,Industrial Machinery/Components
DAVA,Endava plc American Depositary Shares (each representing one Class A Ordinary Share),$90.23,0.01,0.011%,4973238039.00,,2018,177426,Technology,EDP Services
DB,Deutsche Bank AG Common Stock,$14.14,0.27,1.947%,29626128000.00,Germany,,4764338,Finance,Commercial Banks
DBD,Diebold Nixdorf Incorporated Common Stock,$13.69,-1.25,-8.367%,1070262159.00,United States,,1798512,Technology,EDP Services
DBI,Designer Brands Inc. Class A Common Stock,$19.35,0.27,1.415%,1403138528.00,United States,,974178,Consumer Services,Clothing/Shoe/Accessory Stores
DBL,DoubleLine Opportunistic Credit Fund Common Shares of Beneficial Interest,$19.86,-0.06,-0.301%,297296613.00,United States,2012,20562,,
DCF,BNY Mellon Alcentra Global Credit Income 2024 Target Term Fund Inc. Common Stock,$9.68,0.31,3.308%,144843118.00,,2017,24921,,
DCI,Donaldson Company Inc. Common Stock,$64.99,0.71,1.105%,8196769255.00,United States,,499978,Capital Goods,Pollution Control Equipment
DCO,Ducommun Incorporated Common Stock,$58.00,0.97,1.701%,686317712.00,United States,,45063,Capital Goods,Military/Government/Technical
DCP,DCP Midstream  LP Common Units ,$25.31,0.28,1.119%,5273599471.00,United States,,544676,Public Utilities,Natural Gas Distribution
DCP^B,DCP Midstream LP 7.875% Series B Fixed-to-Floating Rate Cumulative Redeemable Perpetual Preferred Units,$24.35,0.00,0.00%,,United States,,31170,,
DCP^C,DCP Midstream LP 7.95% Series C Fixed-to-Floating Rate Cumulative Redeemable Perpetual Preferred Units,$24.32,-0.13,-0.532%,,United States,,21150,,
DCUE,Dominion Energy Inc. 2019 Series A Corporate Units,$102.60,0.23,0.225%,0.00,United States,2019,8417,Public Utilities,Electric Utilities: Central
DD,DuPont de Nemours Inc. Common Stock,$82.85,1.45,1.781%,44285417957.00,,2017,2827900,Capital Goods,Wholesale Distributors
DDD,3D Systems Corporation Common Stock,$19.21,0.79,4.289%,2399267951.00,United States,,2569615,Technology,Computer peripheral equipment
DDF,Delaware Investments Dividend & Income Fund Inc. Common Stock,$11.27,0.23,2.083%,85777762.00,United States,1993,34824,,
DDS,Dillard's Inc. Common Stock,$106.23,0.74,0.701%,2324788523.00,United States,,294759,Consumer Services,Department/Specialty Retail Stores
DDT,Dillard's Capital Trust I,$25.87,0.11,0.427%,0.00,United States,,8864,Consumer Services,Department/Specialty Retail Stores
DE,Deere & Company Common Stock,$394.22,4.31,1.105%,123563892225.00,United States,,1597201,Capital Goods,Industrial Machinery/Components
DEA,Easterly Government Properties Inc. Common Stock,$21.18,0.01,0.047%,1776090265.00,United States,2015,364094,Consumer Services,Real Estate Investment Trusts
DECK,Deckers Outdoor Corporation Common Stock,$341.29,0.87,0.256%,9614111997.00,United States,1993,160386,Consumer Non-Durables,Shoe Manufacturing
DEH,D8 Holdings Corp. Class A Ordinary Shares,$9.93,0.01,0.101%,428231250.00,Hong Kong,2020,64120,Finance,Business Services
DEI,Douglas Emmett Inc. Common Stock,$32.44,0.52,1.629%,5692268146.00,United States,2006,1063328,Consumer Services,Real Estate Investment Trusts
DELL,Dell Technologies Inc. Class C Common Stock ,$101.06,1.29,1.293%,77075166433.00,,2018,2102227,Technology,Computer Manufacturing
DEN,Denbury Inc. Common Stock,$58.81,1.81,3.175%,2940830453.00,,2020,1842773,Energy,Oil & Gas Production
DEO,Diageo plc Common Stock,$183.24,1.54,0.848%,107200357008.00,United Kingdom,,215782,Consumer Non-Durables,Beverages (Production/Distribution)
DESP,Despegar.com Corp. Ordinary Shares,$13.33,0.56,4.385%,934424042.00,,2017,285663,Transportation,Other Consumer Services
DEX,Delaware Enhanced Global Dividend Common Shares of Beneficial Interest,$10.22,0.02,0.196%,121602660.00,United States,2007,62270,,
DFIN,Donnelley Financial Solutions Inc. Common Stock ,$26.67,1.06,4.139%,907560418.00,,2016,286855,Finance,Investment Managers
DFNS,LGL Systems Acquisition Corp. Common Stock,$9.95,-0.02,-0.201%,214546875.00,United States,2020,13831,,
DFP,Flaherty & Crumrine Dynamic Preferred and Income Fund Inc. Common Stock,$30.21,-0.02,-0.066%,580098099.00,,2013,36952,,
DFS,Discover Financial Services Common Stock,$119.46,1.73,1.469%,36421863975.00,United States,,1519894,Finance,Finance: Consumer Services
DG,Dollar General Corporation Common Stock,$220.20,1.70,0.778%,52685988290.00,United States,2009,1374298,Consumer Services,Department/Specialty Retail Stores
DGNR,Dragoneer Growth Opportunities Corp. Class A Ordinary Shares,$10.40,-0.04,-0.383%,897000000.00,United States,2020,70723,Finance,Business Services
DGX,Quest Diagnostics Incorporated Common Stock,$138.95,0.56,0.405%,16891561935.00,United States,,1264885,Health Care,Medical Specialities
DHF,BNY Mellon High Yield Strategies Fund Common Stock,$3.18,0.01,0.315%,231210448.00,United States,1998,655717,,
DHI,D.R. Horton Inc. Common Stock,$103.87,2.37,2.335%,37443423949.00,United States,,2438259,,
DHR,Danaher Corporation Common Stock,$258.48,1.49,0.58%,184368321284.00,United States,,2630457,Health Care,Medical Specialities
DHR^A,Danaher Corporation 4.75% Mandatory Convertible Preferred Stock Series A,$1755.6849,43.7549,2.556%,,United States,,5109,,
DHR^B,Danaher Corporation 5.00% Mandatory Convertible Preferred Stock Series B,$1425.09,0.00,0.00%,,United States,,1492,,
DHT,DHT Holdings Inc.,$5.89,0.07,1.203%,1010129134.00,Jersey,2005,3116952,Transportation,Marine Transportation
DHX,DHI Group Inc. Common Stock,$3.10,0.08,2.649%,162245760.00,United States,2007,272400,Technology,Diversified Commercial Services
DIAX,Nuveen Dow 30SM Dynamic Overwrite Fund Common Shares of Beneficial Interest,$16.91,0.13,0.775%,614964516.00,,2014,79075,,
DIN,Dine Brands Global Inc. Common Stock,$98.96,0.98,1.00%,1688038503.00,United States,,254985,Consumer Services,Restaurants
DIS,Walt Disney Company (The) Common Stock,$184.84,3.05,1.678%,335533379091.00,United States,,6866931,Consumer Services,Movies/Entertainment
DK,Delek US Holdings Inc. Common Stock,$24.93,0.16,0.646%,1841708661.00,United States,2017,1359434,Energy,Integrated oil Companies
DKL,Delek Logistics Partners L.P. Common Units representing Limited Partner Interests,$39.20,-1.55,-3.804%,1702978771.00,United States,2012,153192,Energy,Oil & Gas Production
DKS,Dick's Sporting Goods Inc Common Stock,$89.66,1.93,2.20%,8004882906.00,United States,2002,851905,Consumer Services,Other Specialty Stores
DLB,Dolby Laboratories Common Stock,$96.64,-0.24,-0.248%,9819876744.00,United States,2005,534396,Technology,EDP Services
DLNG,Dynagas LNG Partners LP Common Units,$2.77,0.05,1.838%,101924385.00,Greece,,35421,,
DLNG^A,Dynagas LNG Partners LP 9.00% Series A Cumulative Redeemable Preferred Units,$25.61,0.11,0.431%,,Greece,,6708,,
DLNG^B,Dynagas LNG Partners LP 8.75% Series B Fixed to Floating Rate Cumulative Redeemable Perpetual Preferred Units liquidation preference $25.00 per Uni,$24.15,0.1585,0.661%,,Greece,,6940,,
DLR,Digital Realty Trust Inc. Common Stock,$151.18,1.65,1.103%,42539188651.00,United States,2004,1312389,Consumer Services,Real Estate Investment Trusts
DLR^C,Digital Realty Trust Inc. 6.625% Series C Cumulative Redeemable Perpetual Preferred Stock,$25.21,0.02,0.079%,,United States,,140797,,
DLR^J,Digital Realty Trust Inc. 5.250% Series J Cumulative Redeemable Preferred Stock,$26.79,0.11,0.412%,,United States,,8525,,
DLR^K,Digital Realty Trust Inc. 5.850% Series K Cumulative Redeemable Preferred Stock par value $0.01 per share,$28.14,0.08,0.285%,,United States,,4817,,
DLR^L,Digital Realty Trust Inc. 5.200% Series L Cumulative Redeemable Preferred Stock,$27.40,0.02,0.073%,,United States,,8922,,
DLX,Deluxe Corporation Common Stock,$46.64,-0.18,-0.384%,1963556826.00,United States,,150945,Technology,Advertising
DLY,DoubleLine Yield Opportunities Fund Common Shares of Beneficial Interest,$19.70,-0.01,-0.051%,0.00,,2020,148426,,
DM,Desktop Metal Inc. Class A Common Stock,$12.03,0.36,3.085%,2940718438.00,,2019,3234034,Technology,Computer peripheral equipment
DMB,BNY Mellon Municipal Bond Infrastructure Fund Inc. Common Stock,$14.80,0.11,0.749%,272160796.00,,2013,10404,,
DMO,Western Asset Mortgage Opportunity Fund Inc. Common Stock,$14.84,0.06,0.406%,163642372.00,United States,2010,35898,,
DMS,Digital Media Solutions Inc. Class A Ordinary Shares,$11.42,0.39,3.536%,699830881.00,United States,2018,78688,Technology,Advertising
DMYI,dMY Technology Group Inc. III Class A Common Stock,$10.21,-0.05,-0.487%,382875000.00,United States,2021,407478,,
DMYQ,dMY Technology Group Inc. IV Class A Common Stock,$9.82,-0.05,-0.507%,423487500.00,,2021,4724,,
DNB,Dun & Bradstreet Holdings Inc. Common Stock,$22.58,-0.02,-0.088%,9741881940.00,United States,2020,2807092,Technology,EDP Services
DNMR,Danimer Scientific Inc. Common Stock,$17.45,-0.21,-1.189%,1541318697.00,,2020,4661875,Consumer Non-Durables,Plastic Products
DNOW,NOW Inc. Common Stock,$11.53,0.21,1.855%,1271240185.00,,2014,844157,Energy,Metal Fabrications
DNP,DNP Select Income Fund Inc. Common Stock,$10.24,-0.01,-0.098%,3167258102.00,United States,1987,605212,,
DNZ,D and Z Media Acquisition Corp. Class A Common Stock,$9.76,-0.04,-0.408%,350750000.00,,2021,3606,,
DOC,Physicians Realty Trust Common Shares of Beneficial Interest,$18.66,0.50,2.753%,3933999501.00,United States,2013,2461960,Consumer Services,Real Estate Investment Trusts
DOCN,DigitalOcean Holdings Inc. Common Stock,$42.30,0.03,0.071%,4506345858.00,,2021,247418,Technology,Retail: Computer Software & Peripheral Equipment
DOOR,Masonite International Corporation Ordinary Shares (Canada),$129.92,1.41,1.097%,3188277855.00,Canada,,134598,,
DOV,Dover Corporation Common Stock,$152.91,0.24,0.157%,22007919162.00,United States,,817931,Capital Goods,Industrial Machinery/Components
DOW,Dow Inc. Common Stock ,$69.04,0.00,0.00%,51572151076.00,,2019,5174831,Basic Industries,Industrial Specialties
DPG,Duff & Phelps Utility and Infrastructure Fund Inc.,$14.75,0.15,1.027%,559464639.00,United States,2011,145120,,
DPZ,Domino's Pizza Inc Common Stock,$432.47,2.44,0.567%,16792115121.00,United States,2004,566033,Consumer Non-Durables,Food Distributors
DQ,DAQO New Energy Corp. American Depositary Shares each representing five ordinary shares,$74.70,1.11,1.508%,5491464426.00,China,2010,1341726,Technology,Semiconductors
DRD,DRDGOLD Limited American Depositary Shares,$10.90,0.32,3.025%,932074031.00,South Africa,,436841,Basic Industries,Precious Metals
DRE,Duke Realty Corporation Common Stock,$45.93,0.30,0.657%,17223073451.00,United States,,1754393,Consumer Services,Real Estate Investment Trusts
DRH,Diamondrock Hospitality Company Common Stock,$10.11,0.38,3.905%,2140081201.00,United States,2005,1275840,Consumer Services,Real Estate Investment Trusts
DRH^A,Diamondrock Hospitality Company 8.250% Series A Cumulative Redeemable Preferred Stock,$28.94,-0.07,-0.241%,,United States,,5293,,
DRI,Darden Restaurants Inc. Common Stock,$142.38,0.63,0.444%,18629379924.00,United States,,989480,Consumer Services,Restaurants
DRQ,Dril-Quip Inc. Common Stock,$36.37,1.10,3.119%,1288577971.00,United States,1997,357177,Energy,Metal Fabrications
DRUA,Dominion Energy Inc. 2016 Series A 5.25% Enhanced Junior Subordinated Notes due 2076,$25.36,0.00,0.00%,0.00,United States,2016,107533,,
DS,Drive Shack Inc.,$2.80,-0.60,-17.647%,255615514.00,United States,,10390568,Consumer Services,Movies/Entertainment
DS^B,Drive Shack Inc. Preferred Series B,$25.09,0.03,0.12%,,United States,,9340,,
DS^C,Drive Shack Inc. Preferred Series C,$23.49,0.10,0.428%,,United States,,253,,
DS^D,Drive Shack Inc. Pfd Ser D,$23.4532,0.2032,0.874%,,United States,,2649,,
DSE,Duff & Phelps Select MLP and Midstream Energy Fund Inc.,$8.27,0.12,1.472%,21695146.00,United States,2014,36746,,
DSL,DoubleLine Income Solutions Fund Common Shares of Beneficial Interests,$18.37,0.19,1.045%,1873681730.00,,2013,352741,,
DSM,BNY Mellon Strategic Municipal Bond Fund Inc. Common Stock,$8.17,0.04,0.492%,403773745.00,United States,1989,52643,,
DSSI,Diamond S Shipping Inc. Common Stock ,$10.76,-0.27,-2.448%,436814918.00,,2019,312542,Consumer Services,Transportation Services
DSU,Blackrock Debt Strategies Fund Inc. Common Stock,$11.14,0.03,0.27%,519032730.00,United States,1998,94411,,
DSX,Diana Shipping inc. common stock,$3.98,0.26,6.989%,364309308.00,Greece,2005,2806268,Transportation,Marine Transportation
DSX^B,Diana Shipping Inc. Perpetual Preferred Shares Series B (Marshall Islands),$25.66,-0.03,-0.117%,,Greece,,5537,,
DT,Dynatrace Inc. Common Stock,$46.78,0.52,1.124%,13219738104.00,United States,2019,1558947,Technology,EDP Services
DTB,DTE Energy Company 2020 Series G 4.375% Junior Subordinated Debentures due 2080,$25.32,0.03,0.119%,0.00,United States,2020,28744,Public Utilities,Electric Utilities: Central
DTE,DTE Energy Company Common Stock,$141.69,0.39,0.276%,27449229780.00,United States,,654153,Public Utilities,Electric Utilities: Central
DTF,DTF Tax-Free Income Inc. Common Stock,$14.85,0.11,0.746%,104389055.00,United States,1991,3755,,
DTJ,DTE Energy Company 2016 Series B 5.375% Junior Subordinated Debentures due 2076,$25.34,-0.04,-0.158%,0.00,United States,2016,188070,,
DTLA^,Brookfield DTLA Inc. 7.625% Series A Cumulative Redeemable Preferred Stock,$15.26,0.54,3.668%,,,,44239,,
DTP,DTE Energy Company 6.25% Corporate Units,$51.51,0.19,0.37%,0.00,United States,,29887,Public Utilities,Electric Utilities: Central
DTW,DTE Energy Company 2017 Series E 5.25% Junior Subordinated Debentures due 2077,$26.30,0.00,0.00%,0.00,United States,2017,18914,,
DTY,DTE Energy Company 2016 Series F 6.00% Junior Subordinated Debentures due 2076,$26.01,0.04,0.154%,0.00,United States,2016,61874,,
DUK,Duke Energy Corporation (Holding Company) Common Stock,$100.86,0.32,0.318%,77583178005.00,United States,,4544797,Public Utilities,Power Generation
DUK^A,Duke Energy Corporation Depositary Shares each representing a 1/1000th interest in a share of 5.75% Series A Cumulative Redeemable Perpetual Preferred Stock,$28.3293,0.1293,0.459%,,United States,,45338,,
DUKB,Duke Energy Corporation 5.625% Junior Subordinated Debentures due 2078,$27.14,0.07,0.259%,0.00,United States,2018,50578,,
DUKH,Duke Energy Corporation 5.125% Junior Subordinated Debentures due 2073,$26.07,0.21,0.812%,0.00,United States,,6094,Public Utilities,Power Generation
DV,DoubleVerify Holdings Inc. Common Stock,$36.42,2.21,6.46%,5706269211.00,,2021,296241,Technology,Computer Software: Prepackaged Software
DVA,DaVita Inc. Common Stock,$126.80,2.50,2.011%,13466160000.00,United States,,482082,Health Care,Medical/Nursing Services
DVD,Dover Motorsports Inc. Common Stock,$2.18,0.00,0.00%,79451388.00,United States,1996,16065,Consumer Services,Services-Misc. Amusement & Recreation
DVN,Devon Energy Corporation Common Stock,$26.22,0.95,3.759%,17747922288.00,United States,,13217733,Energy,Oil & Gas Production
DWIN,Delwinds Insurance Acquisition Corp. Class A Common Stock,$9.79,0.01,0.102%,252471863.00,,2021,6154,,
DX,Dynex Capital Inc. Common Stock,$20.12,-0.07,-0.347%,621296928.00,United States,,373643,Consumer Services,Real Estate Investment Trusts
DX^C,Dynex Capital Inc. 6.900% Series C Fixed-to-Floating Rate Cumulative Redeemable Preferred Stock,$25.59,-0.05,-0.195%,,United States,,9579,,
DXC,DXC Technology Company Common Stock ,$34.50,0.70,2.071%,8783492759.00,,,1859010,Technology,EDP Services
DY,Dycom Industries Inc. Common Stock,$98.74,3.85,4.057%,3023553383.00,United States,,430379,Basic Industries,Water Supply
DYFN,Angel Oak Dynamic Financial Strategies Income Term Trust Common Shares of Beneficial Interest,$19.60,-0.2376,-1.198%,79478000.00,,2020,12796,Finance,Finance/Investors Services
E,ENI S.p.A. Common Stock,$25.35,0.30,1.198%,45282066814.00,Italy,,287749,Energy,Oil & Gas Production
EAF,GrafTech International Ltd. Common Stock,$13.29,0.24,1.839%,3551555662.00,United States,2018,2582805,Consumer Durables,Metal Fabrications
EAI,Entergy Arkansas LLC First Mortgage Bonds 4.875% Series Due September 1 2066,$25.54,-0.12,-0.468%,0.00,United States,2016,45911,,
EARN,Ellington Residential Mortgage REIT Common Shares of Beneficial Interest,$12.12,-0.01,-0.082%,149603729.00,United States,2013,38536,Consumer Services,Real Estate Investment Trusts
EAT,Brinker International Inc. Common Stock,$64.80,1.34,2.112%,2964659486.00,United States,,894698,Consumer Services,Restaurants
EB,Eventbrite Inc. Class A Common Stock,$22.07,1.54,7.501%,2065421480.00,United States,2018,2661927,Technology,EDP Services
EBF,Ennis Inc. Common Stock,$21.36,0.07,0.329%,556845438.00,United States,,43416,Consumer Services,Office Equipment/Supplies/Services
EBR,Centrais Electricas Brasileiras S A American Depositary Shares (Each representing one Common Share),$7.35,0.29,4.108%,11531642189.00,,2016,949112,Public Utilities,Electric Utilities: Central
EBS,Emergent Biosolutions Inc. Common Stock,$61.62,0.77,1.265%,3301937154.00,United States,2006,431606,Health Care,Major Pharmaceuticals
EC,Ecopetrol S.A. American Depositary Shares,$12.24,0.17,1.408%,25163417144.00,Colombia,,865087,Energy,Oil & Gas Production
ECC           ,Eagle Point Credit Company Inc. Common Stock,$12.99,-0.07,-0.536%,420290021.00,United States,2014,121661,Finance,Trusts Except Educational Religious and Charitable
ECCB,Eagle Point Credit Company Inc. 7.75% Series B Term Preferred Stock due 2026,$25.6892,-0.1608,-0.622%,0.00,United States,2016,2054,Finance,Trusts Except Educational Religious and Charitable
ECCW,Eagle Point Credit Company Inc. 6.75% Notes due 2031,$25.44,0.08,0.315%,0.00,United States,2021,125352,Finance,Trusts Except Educational Religious and Charitable
ECCX,Eagle Point Credit Company Inc. 6.6875% Notes due 2028,$25.52,-0.0133,-0.052%,0.00,United States,2018,5483,,
ECCY,Eagle Point Credit Company Inc. 6.75% Notes due 2027,$25.5969,0.1169,0.459%,0.00,United States,2017,881,,
ECL,Ecolab Inc. Common Stock,$228.43,-0.07,-0.031%,65348823581.00,United States,,733619,Consumer Non-Durables,Package Goods/Cosmetics
ECOM          ,ChannelAdvisor Corporation Common Stock,$23.16,0.06,0.26%,688213342.00,United States,2013,255317,Technology,Computer Software: Prepackaged Software
ED,Consolidated Edison Inc. Common Stock,$78.09,0.23,0.295%,26760532002.00,United States,,2656210,Public Utilities,Power Generation
EDD,Morgan Stanley Emerging Markets Domestic Debt Fund Inc. Morgan Stanley Emerging Markets Domestic Debt Fund Inc. Common Stock,$6.14,0.03,0.491%,405805648.00,United States,2007,169165,,
EDF,Stone Harbor Emerging Markets Income Fund Common Shares of Beneficial Interest,$8.55,0.07,0.825%,142578689.00,United States,2010,110887,,
EDI,Stone Harbor Emerging Markets Total Income Fund Common Shares of Beneficial Interests,$8.85,-0.03,-0.338%,87421698.00,United States,2012,37099,,
EDN,Empresa Distribuidora Y Comercializadora Norte S.A. (Edenor) Empresa Distribuidora Y Comercializadora Norte S.A. (Edenor) American Depositary Shares,$3.53,0.00,0.00%,159989325.00,Argentina,2007,24049,Public Utilities,Electric Utilities: Central
EDR,Endeavor Group Holdings Inc. Class A Common Stock,$31.61,2.92,10.178%,21553152977.00,,2021,3004220,Consumer Services,Movies/Entertainment
EDU,New Oriental Education & Technology Group Inc. Sponsored ADR representing 1 Ordinary Share (Cayman Islands),$14.93,0.13,0.878%,25405766929.00,China,2006,5482924,Miscellaneous,Other Consumer Services
EEA,The European Equity Fund Inc. Common Stock,$11.52,0.16,1.408%,83067172.00,United States,,15453,,
EEX,Emerald Holding Inc. Common Stock,$5.05,0.06,1.202%,364981549.00,United States,2017,69681,Technology,Advertising
EFC,Ellington Financial Inc. Common Stock ,$18.16,0.29,1.623%,795075381.00,United States,2010,906619,Finance,Real Estate
EFC^A,Ellington Financial Inc. 6.750% Series A Fixed-to-Floating Rate Cumulative Redeemable Preferred Stock,$25.49,-0.0092,-0.036%,,United States,,4035,,
EFF,Eaton vance Floating-Rate Income Plus Fund Common Shares of Beneficial Interest,$16.425,-0.005,-0.03%,124935481.00,,2013,20711,Finance,Investment Managers
EFL,Eaton Vance Floating-Rate 2022 Target Term Trust Common Shares of Beneficial Interest,$9.51,-0.04,-0.419%,224641530.00,United States,2017,64436,,
EFR,Eaton Vance Senior Floating-Rate Fund Common Shares of Beneficial Interest,$14.05,-0.05,-0.355%,517718798.00,United States,2003,109457,,
EFT,Eaton Vance Floating Rate Income Trust Common Shares of Beneficial Interest,$14.29,-0.02,-0.14%,569652130.00,United States,2004,69816,,
EFX,Equifax Inc. Common Stock,$239.56,2.40,1.012%,29155057129.00,United States,,753350,Technology,Advertising
EGF,Blackrock Enhanced Government Fund Inc. Common Stock,$12.95,-0.0369,-0.284%,55189999.00,United States,2005,16567,,
EGHT,8x8 Inc Common Stock,$28.96,-0.46,-1.564%,3112805391.00,United States,,2666422,Technology,EDP Services
EGO,Eldorado Gold Corporation Ordinary Shares,$11.15,0.13,1.18%,2027148385.00,Canada,,1569715,,
EGP,EastGroup Properties Inc. Common Stock,$156.15,1.82,1.179%,6249363003.00,United States,,151387,Consumer Services,Real Estate Investment Trusts
EGY,VAALCO Energy Inc.  Common Stock,$2.71,0.13,5.039%,156671292.00,United States,,148191,Energy,Oil & Gas Production
EHC,Encompass Health Corporation Common Stock,$85.36,-0.05,-0.059%,8496940118.00,United States,,439535,Health Care,Medical Specialities
EHI,Western Asset Global High Income Fund Inc Common Stock,$10.41,0.0401,0.387%,236278862.00,United States,2003,15007,,
EHT,Eaton Vance 2021 Target Term Trust Common Shares of Beneficial Interest,$9.85,0.0005,0.005%,211425364.00,United States,2016,36680,,
EIC,Eagle Point Income Company Inc. Common Stock,$15.472,-0.178,-1.137%,0.00,,2019,9310,Finance,Finance/Investors Services
EIG,Employers Holdings Inc Common Stock,$41.89,-0.39,-0.922%,1194794539.00,United States,2007,104418,Finance,Property-Casualty Insurers
EIX,Edison International Common Stock,$58.58,-0.33,-0.56%,22227481145.00,United States,,1839116,Public Utilities,Electric Utilities: Central
EL,Estee Lauder Companies Inc. (The) Common Stock,$303.35,4.00,1.336%,109967976978.00,United States,1995,1221269,Consumer Non-Durables,Package Goods/Cosmetics
