Symbol,Name,Last Sale,Net Change,% Change,Market Cap,Country,IPO Year,Volume,Sector,Industry
PSA^N,Public Storage Depositary Shares Each Representing 1/1000 of a 3.875% Cumulative Preferred Share of Beneficial Interest Series N,$25.585,-0.028,-0.109%,,United States,,21537,,
PSA^O,Public Storage Depositary Shares Each Representing 1/1000 of a 3.900% Cumulative Preferred Share of Beneficial Interest Series O,$26.17,0.24,0.926%,,United States,,7771,,
PSB,PS Business Parks Inc. Common Stock,$157.00,0.00,0.00%,4322054099.00,United States,,124881,Consumer Services,Real Estate Investment Trusts
PSB^W,PS Business Parks Inc. Depositary Shares Each Representing 1/1000 of a Share of 5.20% Cumulative Preferred Stock Series W,$25.69,-0.01,-0.039%,,United States,,23036,,
PSB^X,PS Business Parks Inc. Depositary Shares Each Representing 1/1000 of a Share of 5.25% Cumulative Preferred Stock Series X,$26.73,0.00,0.00%,,United States,,6004,,
PSB^Y,PS Business Parks Inc. 5.20% Cumulative Preferred Stock Series Y,$26.73,0.0951,0.357%,,United States,,2654,,
PSB^Z,PS Business Parks Inc. Depositary Shares Each Representing 1/1000 of a Share of 4.875% Cumulative Preferred Stock Series Z  par value $0.01 per share,$27.22,0.15,0.554%,,United States,,18483,,
PSF,Cohen & Steers Select Preferred and Income Fund Inc. Common Stock,$30.2863,0.1563,0.519%,363937989.00,,2010,10589,,
PSFE,Paysafe Limited Common Shares,$13.45,0.69,5.408%,9733931538.00,,2021,3827229,Miscellaneous,Business Services
PSN,Parsons Corporation Common Stock,$43.11,0.74,1.747%,4412768139.00,,2019,232293,Capital Goods,Industrial Machinery/Components
PSO,Pearson Plc Common Stock,$11.85,0.33,2.865%,8961377285.00,United Kingdom,,240328,Consumer Services,Books
PSTG,Pure Storage Inc. Class A Common Stock,$18.62,0.35,1.916%,5274858255.00,,2015,5167860,Technology,Electronic Components
PSTH,Pershing Square Tontine Holdings Ltd. Class A Common Stock,$23.73,-0.14,-0.587%,4746002373.00,,2020,1198025,,
PSTL,Postal Realty Trust Inc. Class A Common Stock,$20.28,0.63,3.206%,271160270.00,,2019,213548,Consumer Services,Real Estate Investment Trusts
PSX,Phillips 66 Common Stock,$86.04,0.43,0.502%,37674081326.00,United States,,1894853,Energy,Integrated oil Companies
PSXP,Phillips 66 Partners LP Common Units representing limited partner interest in the Partnership,$35.40,0.63,1.812%,8083241168.00,United States,2013,576616,Energy,Oil & Gas Production
PTA,Cohen & Steers Tax-Advantaged Preferred Securities and Income Fund Common Shares of Beneficial Interest,$25.50,0.05,0.196%,1409473154.00,,2020,44540,,
PTR,PetroChina Company Limited Common Stock,$39.73,0.81,2.081%,72714234480.00,China,,196531,Energy,Oil & Gas Production
PTY,Pimco Corporate & Income Opportunity Fund,$19.60,-0.04,-0.204%,2168087536.00,United States,2002,326119,,
PUK,Prudential Public Limited Company Common Stock,$44.65,0.95,2.174%,58393463915.00,United Kingdom,,547042,Finance,Life Insurance
PUK^,Prudential Public Limited Company 6.75% Perpetual Subordinated Captial Security,$27.72,0.35,1.279%,,United Kingdom,,11306,,
PUK^A,Prudential Public Limited Company 6.50% Perpetual Subordinated Capital Securities Exchangeable at the Issuer's Option Into Non-Cumulative Dollar Denominated Preference Shares,$27.75,0.31,1.13%,,United Kingdom,,3345,,
PUMP,ProPetro Holding Corp. Common Stock,$10.98,0.52,4.971%,1120594809.00,United States,2017,1051499,Energy,Oilfield Services/Equipment
PV,Primavera Capital Acquisition Corporation Class A Ordinary Shares,$9.82,-0.15,-1.505%,527825000.00,,2021,9723,Finance,Business Services
PVG,Pretium Resources Inc. Ordinary Shares (Canada),$11.45,-0.05,-0.435%,2150688812.00,Canada,,1054451,,
PVH,PVH Corp. Common Stock,$118.67,2.89,2.496%,8445789113.00,United States,,752813,,
PVL,Permianville Royalty Trust Trust Units ,$1.60,0.02,1.266%,52800000.00,United States,2011,83950,Energy,Oil & Gas Production
PWR,Quanta Services Inc. Common Stock,$100.18,1.59,1.613%,13974424769.00,United States,,1584412,Capital Goods,Engineering & Construction
PXD,Pioneer Natural Resources Company Common Stock,$167.83,2.89,1.752%,36378409547.00,United States,,2028994,Energy,Oil & Gas Production
PYN,PIMCO New York Municipal Income Fund III Common Shares of Beneficial Interest,$10.7843,0.0243,0.226%,61772470.00,United States,2002,15744,,
PYS,Merrill Lynch Depositor Inc PPlus Tr Ser RRD-1 Tr Ctf Cl A,$22.0001,0.2501,1.15%,0.00,United States,,4129,Finance,Trusts Except Educational Religious and Charitable
PYT,PPlus Tr GSC-2 Tr Ctf Fltg Rate,$24.00,-0.14,-0.58%,0.00,United States,,2500,,
PZC,PIMCO California Municipal Income Fund III Common Shares of Beneficial Interest,$11.07,0.00,0.00%,247757670.00,United States,2002,8689,,
PZN,Pzena Investment Management Inc Class A Common Stock,$11.23,0.29,2.651%,815185262.00,United States,2007,36404,Finance,Investment Managers
QD,Qudian Inc. American Depositary Shares each representing one Class A Ordinary Share,$1.97,0.07,3.684%,498583750.00,China,2017,5226961,Technology,Computer Software: Prepackaged Software
QFTA,Quantum FinTech Acquisition Corporation Common Stock,$9.77,-0.02,-0.204%,245776563.00,,2021,41394,,
QGEN,Qiagen N.V. Common Shares ,$47.64,-0.07,-0.147%,10881309480.00,Netherlands,,494515,Health Care,Biotechnology: Biological Products (No Diagnostic Substances)
QS,QuantumScape Corporation Class A Common Stock,$31.02,0.04,0.129%,12117262755.00,United States,2020,6504430,Capital Goods,Auto Parts:O.E.M.
QSR,Restaurant Brands International Inc. Common Shares,$69.48,0.77,1.121%,21060309235.00,Canada,2014,963647,,
QTS,QTS Realty Trust Inc. Class A Common Stock,$63.58,0.48,0.761%,4380785981.00,United States,2013,559464,Consumer Services,Real Estate Investment Trusts
QTS^A,QTS Realty Trust Inc. 7.125% Series A Cumulative Redeemable Perpetual Preferred Stock,$27.70,0.05,0.181%,,United States,,1919,,
QTS^B,QTS Realty Trust Inc. 6.50% Series B Cumulative Convertible Perpetual Preferred Stock,$141.09,-0.75,-0.529%,,United States,,11966,,
QTWO,Q2 Holdings Inc. Common Stock,$97.44,2.51,2.644%,5486389406.00,,2014,702384,Technology,EDP Services
QUAD,Quad Graphics Inc Class A Common Stock,$3.20,0.05,1.587%,172821437.00,United States,,381048,Consumer Services,Recreational Products/Toys
QUOT,Quotient Technology Inc. Common Stock,$12.91,0.27,2.136%,1205270241.00,,2014,1447570,Technology,Advertising
QVCC,QVC Inc. 6.250% Senior Secured Notes due 2068,$25.82,0.05,0.194%,0.00,United States,2019,19519,,
QVCD,QVC Inc. 6.375% Senior Secured Notes due 2067,$25.70,0.05,0.195%,0.00,United States,2018,18602,,
R,Ryder System Inc. Common Stock,$87.22,0.17,0.195%,4698575154.00,United States,,448438,Miscellaneous,Rental/Leasing Companies
RA,Brookfield Real Assets Income Fund Inc. Common Stock,$22.18,0.05,0.226%,973544589.00,,2016,316514,,
RAAS,Cloopen Group Holding Limited American Depositary Shares each representing two Class A Ordinary Shares,$9.63,-0.72,-6.957%,1539310249.00,,2021,1083400,Technology,Computer Software: Prepackaged Software
RACE,Ferrari N.V. Common Shares,$200.50,0.39,0.195%,49753135658.00,,2015,389386,Capital Goods,Auto Manufacturing
RAD,Rite Aid Corporation Common Stock,$18.01,0.23,1.294%,992380915.00,United States,,1677356,Health Care,Medical/Nursing Services
RAMP,LiveRamp Holdings Inc. Common Stock,$49.55,1.47,3.057%,3315856815.00,United States,2018,928868,Technology,EDP Services
RBA,Ritchie Bros. Auctioneers Incorporated Common Stock,$67.09,1.02,1.544%,7377758353.00,Canada,,322667,,
RBAC,RedBall Acquisition Corp. Class A Ordinary Shares,$9.92,-0.02,-0.201%,713000000.00,United States,2020,204137,Finance,Business Services
RBC,Regal Beloit Corporation Common Stock,$150.41,-0.41,-0.272%,6110177176.00,United States,,211043,Consumer Durables,Metal Fabrications
RBLX,Roblox Corporation Class A Common Stock,$67.90,2.84,4.365%,37381696419.00,,2021,4786179,Technology,EDP Services
RC,Ready Capital Corproation Common Stock,$14.44,0.10,0.697%,1033169249.00,United States,2013,405758,Consumer Services,Real Estate Investment Trusts
RC^B,Ready Capital Corporation 8.625% Series B Cumulative Preferred Stock,$25.45,0.12,0.474%,,United States,,2695,,
RC^C,Ready Capital Corporation 6.25% Series C Cumulative Convertible Preferred Stock,$25.10,0.07,0.28%,,United States,,2186,,
RC^D,Ready Capital Corporation 7.625% Series D Cumulative Redeemable Preferred Stock,$25.22,0.02,0.079%,,United States,,5426,,
RCA,Ready Capital Corporation 7.00% Convertible Senior Notes due 2023,$25.74,0.05,0.195%,0.00,United States,2017,3052,,
RCB,Ready Capital Corporation 6.20% Senior Notes due 2026,$26.00,0.18,0.697%,0.00,United States,2019,10497,,
RCC,Ready Capital Corporation 5.75% Senior Notes due 2026,$25.56,-0.12,-0.467%,,United States,2021,18238,Finance,Finance Companies
RCI,Rogers Communication Inc. Common Stock,$50.76,0.86,1.723%,25630009142.00,Canada,,303026,,
RCL,D/B/A Royal Caribbean Cruises Ltd. Common Stock,$84.29,3.59,4.449%,21457760679.00,United States,1993,3664255,,
RCS,PIMCO Strategic Income Fund Inc.,$7.7089,0.0389,0.507%,340625455.00,United States,1994,133183,,
RCUS,Arcus Biosciences Inc. Common Stock,$30.45,0.32,1.062%,2161679360.00,,2018,560347,Health Care,Major Pharmaceuticals
RDN,Radian Group Inc. Common Stock,$23.60,0.51,2.209%,4514671056.00,United States,,1253491,Finance,Property-Casualty Insurers
RDS/B,Royal Dutch Shell PLC,$38.75,0.81,2.135%,,Netherlands,,3250874,,
RDY,Dr. Reddy's Laboratories Ltd Common Stock,$71.02,0.33,0.467%,11810713426.00,India,,95975,Health Care,Major Pharmaceuticals
RE,Everest Re Group Ltd. Common Stock,$273.10,-0.22,-0.08%,10946394200.00,Bermuda,,296791,Finance,Property-Casualty Insurers
RELX,RELX PLC PLC American Depositary Shares (Each representing One Ordinary Share),$26.75,0.30,1.134%,51712261307.00,United Kingdom,2015,365811,Consumer Services,Publishing
RENN,Renren Inc. American Depositary Shares each representing fifteen Class A ordinary shares,$9.63,-0.25,-2.53%,227073878.00,China,2011,23245,Technology,EDP Services
RES,RPC Inc. Common Stock,$5.84,0.29,5.225%,1259892540.00,United States,,1470509,Energy,Oilfield Services/Equipment
REV,Revlon Inc. New Common Stock,$11.17,-0.21,-1.845%,597442775.00,United States,1996,162327,Consumer Non-Durables,Package Goods/Cosmetics
REVG,REV Group Inc. Common Stock,$18.80,0.51,2.788%,1217077521.00,United States,2017,400358,Capital Goods,Industrial Machinery/Components
REX,REX American Resources Corporation,$83.44,1.69,2.067%,499972647.00,United States,,15253,Basic Industries,Automotive Aftermarket
REXR,Rexford Industrial Realty Inc. Common Stock,$55.03,0.45,0.824%,7376920081.00,United States,2013,361373,Consumer Services,Real Estate Investment Trusts
REXR^A,Rexford Industrial Realty Inc. 5.875% Series A Cumulative Redeemable Preferred Stock,$25.36,0.00,0.00%,,United States,,122,,
REXR^B,Rexford Industrial Realty Inc. 5.875% Series B Cumulative Redeemable Preferred Stock,$26.2236,0.0636,0.243%,,United States,,906,,
REXR^C,Rexford Industrial Realty Inc. 5.625% Series C Cumulative Redeemable Preferred Stock par value $0.01 per share,$27.11,0.1981,0.736%,,United States,,194,,
REZI,Resideo Technologies Inc. Common Stock ,$30.28,0.31,1.034%,4387467595.00,,2018,904708,Miscellaneous,Diversified Manufacture
RF,Regions Financial Corporation Common Stock,$22.89,0.21,0.926%,21989828592.00,United States,,5183911,Finance,Major Banks
RF^A,Regions Financial Corporation Depositary Shares Representing 1/40th Perpetual Preferred Series A,$25.45,0.06,0.236%,,United States,,50686,,
RF^B,Regions Financial Corporation Depositary Shares Representing 1/40th Perpetual Preferred Series B,$29.03,0.11,0.38%,,United States,,90465,,
RF^C,Regions Financial Corporation Depositary Shares each Representing a 1/40th Interest in a  Share of 5.700% Fixed-to-Floating Rate Non-Cumulative  Perpetual Preferred Stock Series C,$27.88,0.09,0.324%,,United States,,20108,,
RF^E,Regions Financial Corporation Depositary Shares Each Representing a 1/40th Interest in a Share of 4.45% Non-Cumulative Perpetual Preferred Stock Series E,$24.61,0.09,0.367%,,United States,,629622,,
RFI,Cohen & Steers Total Return Realty Fund Inc. Common Stock,$15.74,0.16,1.027%,413184428.00,United States,1993,31574,,
RFL,Rafael Holdings Inc. Class B Common Stock,$46.61,1.81,4.04%,777064954.00,United States,2018,43798,Health Care,Major Pharmaceuticals
RFM,RiverNorth Flexible Municipal Income Fund Inc. Common Stock,$23.67,0.30,1.284%,144734925.00,,2020,9748,,
RFMZ,RiverNorth Flexible Municipal Income Fund II Inc. Common Stock,$20.33,0.19,0.943%,0.00,,2021,28080,,
RFP,Resolute Forest Products Inc. Common Stock,$16.04,1.15,7.723%,1280485198.00,Canada,,1222453,Basic Industries,Paper
RGA,Reinsurance Group of America Incorporated Common Stock,$126.26,-8.17,-6.078%,8583816781.00,United States,,948377,Finance,Life Insurance
RGR,Sturm Ruger & Company Inc. Common Stock,$70.37,0.90,1.296%,1237258781.00,United States,,240432,,
RGS,Regis Corporation Common Stock,$9.67,-0.60,-5.842%,374805970.00,United States,1991,622728,,
RGT,Royce Global Value Trust Inc. Common Stock,$14.8018,-0.0082,-0.055%,82901788.00,,2013,3344,,
RH,RH Common Stock,$701.00,16.03,2.34%,14718768717.00,United States,2012,352227,Consumer Services,Other Specialty Stores
RHI,Robert Half International Inc. Common Stock,$90.32,0.62,0.691%,10186343069.00,United States,,552566,Technology,Diversified Commercial Services
RHP,Ryman Hospitality Properties Inc. (REIT),$78.99,3.34,4.415%,4348388125.00,United States,,261728,Consumer Services,Real Estate Investment Trusts
RICE,Rice Acquisition Corp. Class A Common Stock,$15.04,0.07,0.468%,446069104.00,United States,2020,194737,,
RIG,Transocean Ltd (Switzerland) Common Stock,$4.00,0.41,11.421%,2469195820.00,Switzerland,,32592624,Energy,Oil & Gas Production
RIO,Rio Tinto Plc Common Stock,$93.17,1.81,1.981%,150839050853.00,Australia,2002,3277533,Basic Industries,Steel/Iron Ore
RIV,RiverNorth Opportunities Fund Inc. Common Stock,$18.01,0.05,0.278%,182929371.00,,2015,123897,Finance,Finance Companies
RJF,Raymond James Financial Inc. Common Stock,$136.64,0.19,0.139%,18747008000.00,United States,,528161,Finance,Investment Bankers/Brokers/Service
RKT,Rocket Companies Inc. Class A Common Stock,$18.09,-0.92,-4.84%,35898779155.00,United States,2020,26589061,Finance,Finance: Consumer Services
RL,Ralph Lauren Corporation Common Stock,$139.64,5.64,4.209%,10210248628.00,United States,1997,1201140,Consumer Non-Durables,Apparel
RLGY,Realogy Holdings Corp. Common Stock,$17.95,0.08,0.448%,2089577899.00,United States,2012,825048,Finance,Real Estate
RLI,RLI Corp. Common Stock (DE),$113.26,0.24,0.212%,5119741388.00,United States,,82271,Finance,Property-Casualty Insurers
RLJ,RLJ Lodging Trust Common Shares of Beneficial Interest $0.01 par value,$16.20,0.80,5.195%,2671673641.00,United States,2011,1406064,Consumer Services,Real Estate Investment Trusts
RLJ^A,RLJ Lodging Trust $1.95 Series A Cumulative Convertible  Preferred Shares,$28.10,0.14,0.501%,,United States,,32281,,
RLX,RLX Technology Inc. American Depositary Shares each representing the right to receive one (1) Class A ordinary share,$11.04,0.28,2.602%,17341527893.00,,2021,2474292,Consumer Non-Durables,Farming/Seeds/Milling
RM,Regional Management Corp. Common Stock,$44.17,1.70,4.003%,475875168.00,United States,2012,66331,Finance,Finance: Consumer Services
RMAX,RE/MAX Holdings Inc. Class A Common Stock,$36.33,-0.79,-2.128%,1142585839.00,,2013,113480,Finance,Real Estate
RMD,ResMed Inc. Common Stock,$195.16,2.06,1.067%,28399260093.00,United States,,407763,Health Care,Medical/Dental Instruments
RMI,RiverNorth Opportunistic Municipal Income Fund Inc. Common Stock,$22.90,0.2001,0.882%,145947837.00,,2018,4769,,
RMM,RiverNorth Managed Duration Municipal Income Fund Inc. Common Stock,$20.19,0.14,0.698%,398540848.00,,2019,32625,,
RMO,Romeo Power Inc. Class A Common Stock,$7.72,0.16,2.116%,1007819219.00,,2019,2804355,Capital Goods,Automotive Aftermarket
RMPL^,RiverNorth Specialty Finance Corporation 5.875% ,$25.38,-0.07,-0.275%,,,,100,,
RMT,Royce Micro-Cap Trust Inc. Common Stock,$11.87,0.23,1.976%,519488034.00,United States,,119895,,
RNG,RingCentral Inc. Class A Common Stock,$257.04,-4.25,-1.627%,23357971501.00,,2013,1721253,Technology,EDP Services
RNGR,Ranger Energy Services Inc. Class A Common Stock,$6.03,-0.05,-0.822%,92975883.00,United States,2017,27370,Energy,Oilfield Services/Equipment
RNP,Cohen & Steers REIT and Preferred and Income Fund Inc. Common Shares,$25.61,0.13,0.51%,1218579963.00,United States,2003,61667,,
RNR,RenaissanceRe Holdings Ltd. Common Stock,$164.88,1.29,0.789%,8184266614.00,Bermuda,,969748,Finance,Property-Casualty Insurers
RNR^E,RenaissanceRe Holdings Ltd. 5.375% Series E Preference Shares,$25.48,0.00,0.00%,,Bermuda,,9919,,
RNR^F,RenaissanceRe Holdings Ltd. Depositary Shares each Representing a 1/1000th Interest in a 5.750% Series F Preference Share,$27.44,-0.10,-0.363%,,Bermuda,,5328,,
ROG,Rogers Corporation Common Stock,$190.16,-0.79,-0.414%,3558303205.00,United States,,32446,Capital Goods,Industrial Machinery/Components
ROK,Rockwell Automation Inc. Common Stock,$270.68,2.18,0.812%,31419639803.00,United States,,616170,Capital Goods,Industrial Machinery/Components
ROL,Rollins Inc. Common Stock,$37.12,0.15,0.406%,18267624914.00,United States,,881002,Technology,Industrial Specialties
ROP,Roper Technologies Inc. Common Stock,$444.46,-1.74,-0.39%,46774538385.00,United States,1992,327091,Capital Goods,Office Equipment/Supplies/Services
ROSS,Ross Acquisition Corp II Class A Ordinary Shares,$9.70,-0.03,-0.308%,418312500.00,,2021,1208,,
ROT,Rotor Acquisition Corp. Class A Common Stock,$9.90,-0.01,-0.101%,341550000.00,,2021,56160,,
RPAI,Retail Properties of America Inc. Class A Common Stock,$12.11,0.11,0.917%,2600411277.00,United States,2012,1022152,Consumer Services,Real Estate Investment Trusts
RPM,RPM International Inc. Common Stock,$97.47,-0.19,-0.195%,12623469725.00,United States,,496683,Basic Industries,Paints/Coatings
RPT,RPT Realty Common Stock,$12.98,0.20,1.565%,1052580741.00,United States,,354766,Consumer Services,Real Estate Investment Trusts
RPT^D,RPT Realty 7.25% ,$57.4563,0.2444,0.427%,,United States,,1800,,
RQI,Cohen & Steers Quality Income Realty Fund Inc Common Shares,$14.96,0.17,1.149%,2008278706.00,United States,2002,435924,,
RRC,Range Resources Corporation Common Stock,$11.40,0.23,2.059%,2845332270.00,United States,,5505763,Energy,Oil & Gas Production
RRD,R.R. Donnelley & Sons Company Common Stock,$4.37,-0.02,-0.456%,315514000.00,United States,,994832,Consumer Services,Advertising
RS,Reliance Steel & Aluminum Co. Common Stock (DE),$177.24,2.25,1.286%,11291577916.00,United States,1994,289810,Basic Industries,Steel/Iron Ore
RSF,RiverNorth Specialty Finance Corporation,$18.695,0.02,0.107%,96608263.00,,2019,29796,,
RSG,Republic Services Inc. Common Stock,$110.88,0.11,0.099%,35370598032.00,United States,1998,1148511,Public Utilities,Environmental Services
RSI,Rush Street Interactive Inc. Class A Common Stock,$13.04,0.33,2.596%,2854608151.00,,2020,1226486,Consumer Services,Services-Misc. Amusement & Recreation
RTP,Reinvent Technology Partners Class A Ordinary Shares,$9.90,0.00,0.00%,853875000.00,United States,2020,1394689,Finance,Business Services
RTPZ,Reinvent Technology Partners Z Class A Ordinary Shares,$9.93,0.03,0.303%,285487500.00,United States,2021,94319,Finance,Business Services
RTX,Raytheon Technologies Corporation Common Stock,$85.71,1.03,1.216%,129858352758.00,United States,,6055612,Capital Goods,Military/Government/Technical
RVI,Retail Value Inc. Common Stock ,$18.34,-0.29,-1.557%,386666842.00,United States,2018,74160,Consumer Services,Real Estate Investment Trusts
RVLV,Revolve Group Inc. Class A Common Stock,$58.15,6.40,12.367%,4198392377.00,,2019,3807509,Consumer Services,Catalog/Specialty Distribution
RVT,Royce Value Trust Inc. Common Stock,$19.01,0.25,1.333%,1938500970.00,United States,1986,201172,,
RWT,Redwood Trust Inc. Common Stock,$11.29,0.11,0.984%,1275758710.00,United States,1995,978266,Consumer Services,Real Estate Investment Trusts
RXN,Rexnord Corporation Common Stock,$52.46,0.12,0.229%,6280566808.00,United States,2012,353359,Technology,Industrial Machinery/Components
RY,Royal Bank Of Canada Common Stock,$99.10,0.78,0.793%,141202961634.00,Canada,,791295,,
RY^T,Royal Bank Of Canada 6.750% Fixed Rate/Floating Rate Noncumulative First Preferred Shares Series C-2,$28.72,0.00,0.00%,,Canada,,63,,
RYAM,Rayonier Advanced Materials Inc. Common Stock,$7.77,0.66,9.283%,494037206.00,United States,2014,957686,Basic Industries,Industrial Specialties
RYB,RYB Education Inc. American depositary shares each representing one Class A ordinary share,$2.92,0.12,4.286%,80552130.00,,2017,126464,Miscellaneous,Other Consumer Services
RYI,Ryerson Holding Corporation Common Stock,$16.89,-0.24,-1.401%,643802835.00,United States,2014,95526,Capital Goods,Office Equipment/Supplies/Services
RYN,Rayonier Inc. REIT Common Stock,$37.42,0.37,0.999%,5193738986.00,United States,,413077,Consumer Services,Real Estate Investment Trusts
RZA,Reinsurance Group of America Incorporated 6.20% Fixed-to-Floating Rate Subordinated Debentures due 2042,$26.67,-0.03,-0.112%,0.00,United States,,14354,Finance,Life Insurance
RZB,Reinsurance Group of America Incorporated 5.75% Fixed-To-Floating Rate Subordinated Debentures due 2056,$28.50,0.08,0.281%,0.00,United States,2016,13871,,
SA,Seabridge Gold Inc. Ordinary Shares (Canada),$18.15,0.38,2.138%,1357759102.00,Canada,,446811,,
SAF,Saratoga Investment Corp 6.25% Notes due 2023,$25.6924,-0.0376,-0.146%,0.00,United States,2018,1232,Finance,Finance Companies
SAFE,Safehold Inc. Common Stock,$70.58,-0.12,-0.17%,3759289836.00,United States,2017,87426,Consumer Services,Real Estate Investment Trusts
SAH,Sonic Automotive Inc. Common Stock,$51.58,-0.79,-1.508%,2145458649.00,United States,1997,160870,Consumer Services,Other Specialty Stores
SAIC,SCIENCE APPLICATIONS INTERNATIONAL CORPORATION Common Stock,$90.30,1.68,1.896%,5234491979.00,,,269404,Technology,EDP Services
SAIL,SailPoint Technologies Holdings Inc. Common Stock,$46.30,0.43,0.937%,4257780873.00,United States,2017,814217,Technology,Computer Software: Prepackaged Software
SAK,Saratoga Investment Corp 7.25% Notes due 2025,$26.73,0.12,0.451%,0.00,United States,2020,1200,Finance,Finance Companies
SAM,Boston Beer Company Inc. (The) Common Stock,$1115.15,5.41,0.488%,13701597141.00,United States,,120836,Consumer Non-Durables,Beverages (Production/Distribution)
SAN,Banco Santander S.A. Sponsored ADR (Spain),$3.91,0.03,0.773%,67691979475.00,Spain,,5528253,Finance,Commercial Banks
SAND          ,Sandstorm Gold Ltd. Ordinary Shares (Canada),$8.03,-0.07,-0.864%,1562396699.00,Canada,,2162169,,
SAP,SAP  SE ADS,$141.74,0.07,0.049%,167193575652.00,Germany,,695335,Technology,EDP Services
SAR,Saratoga Investment Corp New,$25.77,-0.16,-0.617%,287851622.00,United States,,33163,,
SAVE,Spirit Airlines Inc. Common Stock,$35.13,0.52,1.502%,3808109670.00,United States,,2438642,Transportation,Air Freight/Delivery Services
SB,Safe Bulkers Inc Common Stock ($0.001 par value),$4.00,0.05,1.266%,421592508.00,Monaco,2008,2035515,Transportation,Marine Transportation
SB^C,Safe Bulkers Inc Cumulative Redeemable Perpetual Preferred Series C (Marshall Islands),$24.98,-0.02,-0.08%,,Monaco,,3093,,
SB^D,Safe Bulkers Inc Perpetual Preferred Series D (Marshall Islands),$25.00,-0.16,-0.636%,,Monaco,,15029,,
SBBA,Scorpio Tankers Inc. 7.00% Senior Notes due 2025,$25.18,0.08,0.319%,0.00,Monaco,2020,39042,Transportation,Marine Transportation
SBG,Sandbridge Acquisition Corporation Class A Common Stock,$9.98,-0.01,-0.10%,286925000.00,,2020,118749,,
SBH,Sally Beauty Holdings Inc. (Name to be changed from Sally Holdings Inc.) Common Stock,$25.29,0.97,3.988%,2853074557.00,United States,,2975608,Miscellaneous,Diversified Commercial Services
SBI,Western Asset Intermediate Muni Fund Inc Common Stock,$9.5406,-0.0394,-0.411%,134353734.00,United States,1992,37827,,
SBII,Sandbridge X2 Corp. Class A Common Stock,$9.80,-0.10,-1.01%,291766933.00,,2021,16027,Health Care,Medical/Nursing Services
SBOW,SilverBow Resorces Inc. Common Stock,$11.15,0.69,6.597%,135409558.00,,,92136,Energy,Oil & Gas Production
SBR,Sabine Royalty Trust Common Stock,$35.15,-0.82,-2.28%,512463977.00,United States,,33330,Energy,Oil & Gas Production
SBS,Companhia de saneamento Basico Do Estado De Sao Paulo - Sabesp American Depositary Shares (Each repstg 250 Common Shares),$8.01,0.19,2.43%,5474914051.00,Brazil,2002,1243431,,
SBSW,D/B/A Sibanye-Stillwater Limited ADS,$19.37,0.30,1.573%,14157390166.00,,,3095962,Basic Industries,Precious Metals
SC,Santander Consumer USA Holdings Inc. Common Stock,$35.93,0.90,2.569%,10995863959.00,,2014,539374,Finance,Finance Companies
SCCO,Southern Copper Corporation Common Stock,$76.87,4.05,5.562%,59426142188.00,United States,,1819464,Basic Industries,Precious Metals
SCD,LMP Capital and Income Fund Inc. Common Stock,$13.61,0.10,0.74%,244456056.00,United States,2004,40524,,
SCE^G,SCE Trust II Trust Preferred Securities,$24.87,0.0786,0.317%,,United States,,23844,,
SCE^H,SCE Trust III Fixed/Floating Rate Trust Preference Securities,$25.75,0.096,0.374%,,United States,,25444,,
SCE^J,Southern California Edison Company 5.375% Fixed-to-Floating Rate Trust Preference Securities,$25.79,0.29,1.137%,,United States,,11462,,
SCE^K,Southern California Edison Company 5.45% Fixed-to-Floating Rate Trust Preference Securities,$25.68,0.14,0.548%,,United States,,12213,,
SCE^L,SCE TRUST VI,$24.70,-0.05,-0.202%,,United States,,51978,,
SCHW,Charles Schwab Corporation (The) Common Stock,$71.75,0.23,0.322%,135262694900.00,United States,,6232254,Finance,Investment Bankers/Brokers/Service
SCHW^C,The Charles Schwab Corporation Depositary Shares each representing 1/40th interest in a share of 6% Non-Cumulative Perpetual Preferred Stock Series C,$25.37,0.01,0.039%,,United States,,31241,,
