Symbol,Name,Last Sale,Net Change,% Change,Market Cap,Country,IPO Year,Volume,Sector,Industry
ITW,Illinois Tool Works Inc. Common Stock,$238.28,1.22,0.515%,75410918021.00,United States,,808047,Capital Goods,Industrial Machinery/Components
IVAN,Ivanhoe Capital Acquisition Corp. Class A Ordinary Shares,$10.09,0.08,0.799%,348105000.00,,2021,163281,Finance,Business Services
IVC,Invacare Corporation Common Stock,$8.06,0.07,0.876%,280668359.00,United States,,764490,Health Care,Industrial Specialties
IVH,Ivy High Income Opportunities Fund Common Shares of Beneficial Interest,$13.99,0.00,0.00%,231817588.00,,2013,31989,,
IVR,INVESCO MORTGAGE CAPITAL INC Common Stock,$3.61,-0.02,-0.551%,833360233.00,United States,2009,8322251,Consumer Services,Real Estate Investment Trusts
IVR^A,Invesco Mortgage Capital Inc. Pfd Ser A,$24.89,0.02,0.08%,,United States,,6546,,
IVR^B,Invesco Mortgage Capital Inc. Preferred Series B Cum Fxd to Fltg,$24.82,0.1436,0.582%,,United States,,11739,,
IVR^C,INVESCO MORTGAGE CAPITAL INC 7.5% Fixed-to-Floating Series C Cumulative Redeemable Preferred Stock Liquation Preference $25.00 per Share,$24.48,0.30,1.241%,,United States,,29588,,
IVZ,Invesco Ltd Common Stock,$28.38,0.13,0.46%,13095981906.00,United States,,3694867,Finance,Investment Managers
IX,Orix Corp Ads Common Stock,$82.75,1.53,1.884%,20182602861.00,Japan,,14002,Finance,Diversified Financial Services
J,Jacobs Engineering Group Inc. Common Stock,$139.95,1.50,1.083%,18205558232.00,United States,,844284,Capital Goods,Oilfield Services/Equipment
JAX,J. Alexander's Holdings Inc. Common Stock,$10.82,0.12,1.121%,163274633.00,,2015,13529,Consumer Services,Restaurants
JBGS,JBG SMITH Properties Common Shares ,$32.16,-0.15,-0.464%,4229012632.00,United States,2017,295029,Consumer Services,Real Estate Investment Trusts
JBL,Jabil Inc. Common Stock,$54.83,2.01,3.805%,8158592311.00,United States,1993,1047319,Technology,Electrical Products
JBT,John Bean Technologies Corporation Common Stock,$145.04,1.99,1.391%,4605068588.00,United States,,72799,Capital Goods,Diversified Manufacture
JCE,Nuveen Core Equity Alpha Fund Nuveen Core Equity Alpha Fund Common Shares of Beneficial Interest,$16.12,0.17,1.066%,258392010.00,United States,2007,38058,,
JCI,Johnson Controls International plc Ordinary Share,$65.70,0.83,1.279%,47088181479.00,Switzerland,,5670734,Capital Goods,Auto Parts:O.E.M.
JCO,Nuveen Credit Opportunities 2022 Target Term Fund Common Shares of Beneficial Interest,$8.68,0.04,0.463%,240874271.00,United States,2017,32970,,
JDD,Nuveen Diversified Dividend and Income Fund Shares of Beneficial Interest,$10.02,0.06,0.602%,197078540.00,United States,2003,42233,,
JEF,Jefferies Financial Group Inc. Common Stock,$33.86,0.24,0.714%,8362485227.00,United States,,1885418,Finance,Finance/Investors Services
JELD,JELD-WEN Holding Inc. Common Stock,$30.88,0.94,3.14%,3093076024.00,United States,2017,306552,,
JEMD,Nuveen Emerging Markets Debt 2022 Target Term Fund Common Shares of Beneficial Interest $0.01 par value per share,$8.13,0.01,0.123%,115828045.00,,2017,55769,,
JEQ,Aberdeen Japan Equity Fund Inc.  Common Stock,$8.94,-0.03,-0.334%,119872312.00,United States,1992,304292,,
JFR,Nuveen Floating Rate Income Fund Common Stock,$9.81,-0.01,-0.102%,558370171.00,United States,2004,196403,,
JGH,Nuveen Global High Income Fund Common Shares of Beneficial Interest,$15.92,0.03,0.189%,368984097.00,United States,2014,42539,,
JHAA,Nuveen Corporate Income 2023 Target Term Fund,$10.05,-0.02,-0.199%,78645863.00,,2018,4597,,
JHB,Nuveen Corporate Income November 2021 Target Term Fund,$9.41,0.00,0.00%,526019461.00,,2016,81733,,
JHG,Janus Henderson Group plc Ordinary Shares,$37.77,0.73,1.971%,6509659085.00,,2017,1176982,Finance,Investment Managers
JHI,John Hancock Investors Trust Common Stock,$18.515,-0.0095,-0.051%,161210568.00,United States,,4434,,
JHS,John Hancock Income Securities Trust Common Stock,$15.8944,-0.0756,-0.473%,185115465.00,United States,,17273,,
JHX,James Hardie Industries plc American Depositary Shares (Ireland),$34.25,0.31,0.913%,15212736498.00,Ireland,,17144,Capital Goods,Building Materials
JIH,Juniper Industrial Holdings Inc. Class A Common Stock,$13.11,0.16,1.236%,565368750.00,,2019,142094,,
JILL,J. Jill Inc. Common Stock,$9.33,0.18,1.967%,90569324.00,,2017,38399,Consumer Services,Clothing/Shoe/Accessory Stores
JKS,JinkoSolar Holding Company Limited American Depositary Shares (each representing 4 Common Shares),$32.41,0.42,1.313%,1545274056.00,China,2010,932315,Technology,Semiconductors
JLL,Jones Lang LaSalle Incorporated Common Stock,$199.03,5.83,3.018%,10211472986.00,United States,,230716,Finance,Real Estate
JLS,Nuveen Mortgage and Income Fund,$21.15,-0.092,-0.433%,116059356.00,United States,2009,15095,,
JMIA,Jumia Technologies AG American Depositary Shares each representing two Ordinary Shares,$26.67,0.91,3.533%,2629464215.00,,2019,6556481,Consumer Services,Catalog/Specialty Distribution
JMM,Nuveen Multi-Market Income Fund (MA),$7.35,0.0169,0.23%,69548280.00,United States,,3151,,
JMP,JMP Group LLC Common Shares,$5.17,0.29,5.943%,102637389.00,United States,2007,66600,Finance,Investment Bankers/Brokers/Service
JNJ,Johnson & Johnson Common Stock,$168.50,0.76,0.453%,443727226506.00,United States,,5315649,Health Care,Major Pharmaceuticals
JNPR,Juniper Networks Inc. Common Stock,$27.20,0.19,0.703%,8914531264.00,United States,1999,3998716,Technology,Computer peripheral equipment
JOE,St. Joe Company (The) Common Stock,$47.16,0.99,2.144%,2776901011.00,United States,,238016,Consumer Services,Homebuilding
JOF,Japan Smaller Capitalization Fund Inc Common Stock,$9.24,0.03,0.326%,261805171.00,United States,1990,61712,,
JP,Jupai Holdings Limited American Depositary Shares each representing six ordinary shares,$2.02,-0.11,-5.164%,67114851.00,,2015,30963,Consumer Services,Other Consumer Services
JPC,Nuveen Preferred & Income Opportunities Fund,$9.82,-0.01,-0.102%,1014947563.00,United States,2003,126436,,
JPI,Nuveen Preferred and Income Term Fund Common Shares of Beneficial Interest,$25.545,0.055,0.216%,581439733.00,,2012,23034,Finance,Finance Companies
JPM,JP Morgan Chase & Co. Common Stock,$161.24,0.55,0.342%,488094136779.00,United States,,14255574,Finance,Major Banks
JPM^C,J P Morgan Chase & Co Depositary Shares each representing a 1/400th interest in a share of 6.00% Non-Cumulative  Preferred Stock Series EE,$27.87,0.17,0.614%,,United States,,156217,,
JPM^D,J P Morgan Chase & Co Depositary Shares each representing a 1/400th  interest in a share of 5.75% Non-Cumulative  Preferred Stock Series DD,$27.29,0.04,0.147%,,United States,,94843,,
JPM^G,J P Morgan Chase & Co Depositary Shares each representing a 1/400th interest in a share of 6.10% Non-Cumulative Preferred Stock Series AA,$25.00,0.01,0.04%,,United States,,68877,,
JPM^H,J P Morgan Chase & Co Depositary Shares each representing a 1/400th interest in a share of 6.15% Non-Cumulative Preferred Stock Series BB,$25.00,0.01,0.04%,,United States,,71933,,
JPM^J,J P Morgan Chase & Co Depositary Shares each representing a 1/400th interest in a share of JPMorgan Chase & Co. 4.75% Non-Cumulative Preferred Stock Series GG,$26.47,0.10,0.379%,,United States,,58994,,
JPM^K,J P Morgan Chase & Co Depositary Shares each representing a 1/400th interest in a share of 4.55% Non-Cumulative Preferred Stock Series JJ,$26.07,-0.04,-0.153%,,United States,,97074,,
JPS,Nuveen Preferred & Income Securities Fund,$9.95,0.06,0.607%,2027711963.00,United States,2002,317152,,
JPT,Nuveen Preferred and Income 2022 Term Fund Common Shares of Beneficial Interest,$24.86,0.05,0.202%,170069050.00,United States,2017,6542,,
JQC,Nuveen Credit Strategies Income Fund Shares of Beneficial Interest,$6.71,0.03,0.449%,909938336.00,United States,2003,579377,,
JRI,Nuveen Real Asset Income and Growth Fund Common Shares of Beneficial Interest,$15.63,0.19,1.231%,429101018.00,United States,2012,58130,,
JRO,Nuveen Floating Rate Income Opportuntiy Fund Shares of Beneficial Interest,$9.60,0.00,0.00%,389195693.00,United States,2004,189752,,
JRS,Nuveen Real Estate Income Fund Common Shares of Beneficial Interest,$10.51,0.07,0.67%,303659870.00,United States,2001,75454,,
JSD,Nuveen Short Duration Credit Opportunities Fund Common Shares of Beneficial Interest,$14.465,0.055,0.382%,145888898.00,United States,2011,53501,Finance,Finance Companies
JT,Jianpu Technology Inc. American depositary shares,$3.05,-0.1399,-4.386%,64603191.00,,2017,299898,Technology,EDP Services
JTA,Nuveen Tax-Advantaged Total Return Strategy Fund Common Share of Beneficial Interest,$11.30,0.10,0.893%,156515136.00,United States,2004,46214,,
JTD,Nuveen Tax-Advantaged Dividend Growth Fund Common Shares of Beneficial Interest,$15.80,0.15,0.958%,228852572.00,United States,,31078,,
JW/A,John Wiley & Sons Inc.,$62.34,0.41,0.662%,,United States,,226749,,
JW/B,John Wiley & Sons Inc.,$61.1199,0.00,0.00%,,United States,,10,,
JWN,Nordstrom Inc. Common Stock,$39.84,1.42,3.696%,6285571939.00,United States,,2198284,Consumer Services,Clothing/Shoe/Accessory Stores
JWS,Jaws Acquisition Corp. Class A Ordinary Shares,$13.40,0.22,1.669%,1155750000.00,,2020,679253,Finance,Business Services
JWSM,Jaws Mustang Acquisition Corp. Class A Ordinary Shares,$9.89,-0.01,-0.101%,1279518750.00,,2021,400605,Finance,Business Services
K,Kellogg Company Common Stock,$66.95,-0.58,-0.859%,22786794030.00,United States,,3925926,Consumer Non-Durables,Packaged Foods
KAHC,KKR Acquisition Holdings I Corp.,$9.80,9.80,,0.00,,,8100,,
KAI,Kadant Inc Common Stock,$185.56,4.67,2.582%,2148372857.00,United States,,23046,Technology,Industrial Machinery/Components
KAMN,Kaman Corporation Common Stock,$55.77,0.63,1.143%,1546566459.00,United States,,232456,Capital Goods,Military/Government/Technical
KAR,KAR Auction Services Inc Common Stock,$16.98,0.26,1.555%,2118443478.00,United States,2009,2811309,,
KB,KB Financial Group Inc,$52.76,1.08,2.09%,20557107515.00,South Korea,,221999,Finance,Commercial Banks
KBH,KB Home Common Stock,$50.83,2.05,4.203%,5018836783.00,United States,1986,1154087,,
KBR,KBR Inc. Common Stock,$41.16,0.67,1.655%,5817809551.00,United States,2006,960453,Capital Goods,Oilfield Services/Equipment
KCAC,Kensington Capital Acquisition Corp. II Class A Common Stock,$10.00,-0.03,-0.299%,0.00,,2021,54522,,
KEN,Kenon Holdings Ltd. Ordinary Shares,$33.94,0.18,0.533%,1828657231.00,Singapore,2015,14231,Public Utilities,Electric Utilities: Central
KEP,Korea Electric Power Corporation Common Stock,$10.92,0.26,2.439%,14020495442.00,South Korea,1994,152944,Public Utilities,Electric Utilities: Central
KEX,Kirby Corporation Common Stock,$67.42,0.41,0.612%,4051002435.00,United States,,257071,Transportation,Marine Transportation
KEY,KeyCorp Common Stock,$23.07,0.18,0.786%,22389883435.00,United States,,7003730,Finance,Major Banks
KEY^I,KeyCorp Depositary Shares Each Representing a 1/40th Ownership Interest in a Share of Fixed-to-Floating Rate Perpetual Non-Cumulative Preferred Stock Series E,$30.31,0.39,1.303%,,United States,,48947,,
KEY^J,KeyCorp Depositary Shares each representing a 1/40th ownership interest in a share of Fixed Rate Perpetual Non-Cumulative Preferred Stock Series F,$27.06,0.22,0.82%,,United States,,22387,,
KEY^K,KeyCorp Depositary Shares each representing a 1/40th ownership interest in a share of Fixed Rate Perpetual Non-Cumulative Preferred Stock Series G,$27.44,-0.03,-0.109%,,United States,,37813,,
KEYS,Keysight Technologies Inc. Common Stock,$143.41,0.60,0.42%,26673461493.00,United States,2014,611964,Capital Goods,Industrial Machinery/Components
KF,Korea Fund Inc. (The) New Common Stock,$45.99,0.93,2.064%,230868696.00,United States,,3195,,
KFS,Kingsway Financial Services Inc. Common Stock (DE),$4.98,-0.06,-1.19%,118054042.00,Canada,,4734,,
KFY,Korn Ferry Common Stock,$67.32,-0.84,-1.232%,3635735689.00,United States,1999,294125,Technology,Diversified Commercial Services
KGC,Kinross Gold Corporation Common Stock,$7.74,0.15,1.976%,9760606854.00,Canada,,13844241,,
KIM,Kimco Realty Corporation Common Stock,$21.46,0.52,2.483%,9302034475.00,United States,,4409255,Consumer Services,Real Estate Investment Trusts
KIM^L,Kimco Realty Corporation Class L Depositary Shares each of which represents a one-one thousandth fractional interest in a share of 5.125% Class L Cumulative Redeemable Preferred Stock liquidation preference $25000.00 per share,$26.50,0.2083,0.792%,,United States,,3613,,
KIM^M,Kimco Realty Corporation Class M Depositary Shares each of which represents a one-one thousandth fractional interest in a share of 5.25% Class M Cumulative Redeemable Preferred Stock liquidation preference $25000.00 per share,$26.57,-0.15,-0.561%,,United States,,6280,,
KIO,KKR Income Opportunities Fund Common Shares,$16.08,0.01,0.062%,327072265.00,,2013,60068,,
KKR,KKR & Co. Inc. Common Stock,$58.72,1.04,1.803%,33955957970.00,United States,,2574682,Finance,Investment Managers
KKR^A,KKR & Co. Inc. 6.75% Series A Preferred Stock,$25.42,0.00,0.00%,,United States,,40929,,
KKR^B,KKR & Co. Inc. 6.50% Series B Preferred Stock,$25.73,0.04,0.156%,,United States,,6454,,
KKR^C,KKR & Co. Inc. 6.00% Series C Mandatory Convertible Preferred Stock,$78.0649,1.4649,1.912%,,United States,,11831,,
KKRS,KKR Group Finance Co. IX LLC 4.625% Subordinated Notes due 2061,$25.63,0.06,0.235%,0.00,,2021,106862,,
KL,Kirkland Lake Gold Ltd. Common Shares,$40.85,1.44,3.654%,10909221342.00,,,3273888,,
KMB,Kimberly-Clark Corporation Common Stock,$135.50,-0.63,-0.463%,45721980174.00,United States,,1509697,Basic Industries,Paper
KMF,Kayne Anderson NextGen Energy & Infrastructure Inc.,$6.90,0.05,0.73%,325662488.00,,2010,109957,,
KMI,Kinder Morgan Inc. Common Stock,$17.84,0.19,1.076%,40400153281.00,United States,2011,13364089,Public Utilities,Natural Gas Distribution
KMPR,Kemper Corporation,$79.48,0.02,0.025%,5131745897.00,United States,,193341,Finance,Property-Casualty Insurers
KMT,Kennametal Inc. Common Stock,$41.81,-0.07,-0.167%,3492514855.00,United States,,346404,Capital Goods,Industrial Machinery/Components
KMX,CarMax Inc,$129.99,-0.30,-0.23%,21211790558.00,United States,,1387383,Consumer Services,Other Specialty Stores
KN,Knowles Corporation Common Stock,$20.48,0.08,0.392%,1900409856.00,,2014,815982,Consumer Non-Durables,Consumer Electronics/Appliances
KNL,Knoll Inc. Common Stock,$24.50,0.04,0.164%,1209961386.00,United States,2004,1533512,,
KNOP,KNOT Offshore Partners LP Common Units representing Limited Partner Interests,$19.44,0.20,1.04%,635573187.00,United Kingdom,2013,87639,Transportation,Marine Transportation
KNX,Knight-Swift Transportation Holdings Inc.,$49.37,0.54,1.106%,8169669102.00,United States,2017,1573780,Transportation,Trucking Freight/Courier Services
KO,Coca-Cola Company (The) Common Stock,$54.51,-0.03,-0.055%,235029713158.00,United States,,10636767,Consumer Non-Durables,Beverages (Production/Distribution)
KODK,Eastman Kodak Company Common New,$7.28,0.41,5.968%,571505305.00,United States,,2373874,Miscellaneous,Business Services
KOF,Coca Cola Femsa S.A.B. de C.V.  American Depositary Shares each representing 10 Units (each Unit consists of 3 Series B Shares and 5 Series L Shares),$47.10,-0.62,-1.299%,9894919945.00,Mexico,1993,308679,Consumer Non-Durables,Beverages (Production/Distribution)
KOP,Koppers Holdings Inc. Koppers Holdings Inc. Common Stock,$38.22,2.48,6.939%,811632544.00,United States,2006,192529,Basic Industries,Industrial Specialties
KOS,Kosmos Energy Ltd. Common Shares (DE),$3.15,0.23,7.877%,1285352192.00,Bermuda,2011,10278058,Energy,Oil & Gas Production
KR,Kroger Company (The) Common Stock,$37.73,0.04,0.106%,28372722339.00,United States,,8049919,Consumer Services,Food Chains
KRA,Kraton Corporation Common Stock,$35.96,-0.19,-0.526%,1155899930.00,United States,2009,900283,Basic Industries,Major Chemicals
KRC,Kilroy Realty Corporation Common Stock,$67.79,0.85,1.27%,7894170582.00,United States,1997,677306,Consumer Services,Real Estate Investment Trusts
KREF,KKR Real Estate Finance Trust Inc. Common Stock,$21.07,-0.10,-0.472%,1171901348.00,United States,2017,247727,Consumer Services,Real Estate Investment Trusts
KREF^A,KKR Real Estate Finance Trust Inc. 6.50% Series A Cumulative Redeemable Preferred Stock,$25.82,0.07,0.272%,,United States,,58692,,
KRG,Kite Realty Group Trust Common Stock,$21.58,0.36,1.697%,1823211808.00,United States,2004,239410,Consumer Services,Real Estate Investment Trusts
KRO,Kronos Worldwide Inc Common Stock,$17.55,0.01,0.057%,2027774683.00,United States,,143159,Basic Industries,Major Chemicals
KRP,Kimbell Royalty Partners Common Units Representing Limited Partner Interests,$12.41,0.76,6.524%,745619581.00,United States,2017,270109,Energy,Oil & Gas Production
KSM,DWS Strategic Municipal Income Trust,$12.11,-0.03,-0.247%,135679726.00,United States,1989,24291,,
KSS,Kohl's Corporation Common Stock,$61.80,1.51,2.505%,9739224967.00,United States,1992,1355537,Consumer Services,Department/Specialty Retail Stores
KSU,Kansas City Southern Common Stock,$305.22,8.91,3.007%,27754796428.00,United States,,1647078,Transportation,Railroads
KSU^,Kansas City Southern Preferred Stock,$37.70,0.20,0.533%,,United States,,178,,
KT,KT Corporation Common Stock,$13.07,0.01,0.077%,6216053940.00,South Korea,,387920,Public Utilities,Telecommunications Equipment
KTB,Kontoor Brands Inc. Common Stock ,$64.53,-2.73,-4.059%,3702218128.00,,2019,487349,,
KTF,DWS Municipal Income Trust,$12.01,0.01,0.083%,474406265.00,United States,1988,473208,,
KTH,Structures Products Cp 8% CorTS Issued by Peco Energy Cap Tr II Preferred Stock,$33.00,0.03,0.091%,0.00,United States,,1337,Finance,Investment Managers
KTN,Structured Products Corp 8.205% CorTS 8.205% Corporate Backed Trust Securities (CorTS),$32.36,0.31,0.967%,0.00,United States,,4496,,
KUKE,Kuke Music Holding Limited American Depositary Shares each representing one Ordinary Share,$4.98,0.41,8.972%,147242281.00,,2021,136663,Consumer Services,Other Consumer Services
KW,Kennedy-Wilson Holdings Inc. Common Stock,$20.35,0.23,1.143%,2865810911.00,United States,,357300,Consumer Services,Real Estate
KWAC,Kingswood Acquisition Corp. Class A Common Stock,$10.03,-0.01,-0.10%,145224370.00,,2021,27600,,
KWR,Quaker Chemical Corporation Common Stock,$242.57,5.89,2.489%,4342711062.00,United States,,71844,Basic Industries,Automotive Aftermarket
KYN,Kayne Anderson Energy Infrastructure Fund Inc.,$7.93,0.07,0.891%,1002729103.00,United States,2004,656112,,
L,Loews Corporation Common Stock,$58.44,0.26,0.447%,15384917205.00,United States,,650651,Finance,Property-Casualty Insurers
LAC,Lithium Americas Corp. Common Shares,$13.33,1.00,8.11%,1591927719.00,Canada,,3221696,,
LAD,Lithia Motors Inc. Common Stock,$379.93,-0.39,-0.103%,10125458960.00,United States,,234553,Consumer Services,Other Specialty Stores
LADR,Ladder Capital Corp Class A Common Stock,$11.85,0.44,3.856%,1497153814.00,,2014,1033168,Consumer Services,Real Estate Investment Trusts
LAIX,LAIX Inc. American Depositary Shares each  representing one Class A Ordinary Share,$1.84,0.09,5.143%,91593984.00,,2018,286501,Miscellaneous,Service to the Health Industry
LAZ,Lazard LTD. Lazard LTD. Class A Common Stock,$46.67,-0.53,-1.123%,4917150967.00,Bermuda,2005,859528,Finance,Investment Managers
LB,L Brands Inc.,$67.29,1.35,2.047%,18767036528.00,United States,,7232393,Consumer Services,Clothing/Shoe/Accessory Stores
LBRT,Liberty Oilfield Services Inc. Class A Common Stock,$14.05,0.95,7.252%,2531401454.00,United States,2018,1762714,Energy,Oilfield Services/Equipment
LC,LendingClub Corporation Common Stock,$14.50,0.38,2.691%,1409807827.00,United States,2014,951853,Finance,Finance Companies
LCI,Lannett Co Inc Common Stock,$4.43,-0.02,-0.449%,183409664.00,United States,,358132,Health Care,Major Pharmaceuticals
LCII,LCI Industries,$146.43,0.73,0.501%,3698008381.00,United States,,80224,Capital Goods,Auto Parts:O.E.M.
LDI,loanDepot Inc. Class A Common Stock,$14.94,-2.07,-12.169%,4855500000.00,,2021,1357606,Finance,Finance: Consumer Services
LDL,Lydall Inc. Common Stock,$39.21,0.26,0.668%,706524794.00,United States,,45610,Technology,Industrial Machinery/Components
LDOS,Leidos Holdings Inc. Common Stock,$104.03,0.13,0.125%,14711939141.00,United States,,642188,Technology,EDP Services
LDP,Cohen & Steers Limited Duration Preferred and Income Fund Inc.,$27.00,-0.07,-0.259%,780945057.00,United States,2012,36401,,
LEA,Lear Corporation Common Stock,$195.12,2.91,1.514%,11732504137.00,United States,,293836,Capital Goods,Auto Parts:O.E.M.
LEAF,Leaf Group Ltd. Common Stock,$8.50,-0.04,-0.468%,305998181.00,United States,,576654,Technology,EDP Services
LEAP,Ribbit LEAP Ltd. Class A Ordinary Shares,$10.85,-0.29,-2.603%,634779250.00,United States,2020,924752,Finance,Business Services
LEG,Leggett & Platt Incorporated Common Stock,$57.53,0.58,1.018%,7660427918.00,United States,,939575,Consumer Durables,Home Furnishings
LEJU,Leju Holdings Limited American Depositary Shares each representing one Ordinary share,$2.17,-0.05,-2.252%,296015351.00,,2014,39587,Finance,Real Estate
LEN,Lennar Corporation Class A Common Stock,$108.05,2.35,2.223%,33860883285.00,United States,,1371989,Consumer Services,Building operators
LEO,BNY Mellon Strategic Municipals Inc. Common Stock,$8.92,0.07,0.791%,554911077.00,United States,1987,85941,,
LEV,The Lion Electric Company,$17.76,17.76,,0.00,,,1812075,,
LEVI,Levi Strauss & Co Class A Common Stock,$30.13,-0.21,-0.692%,12062980276.00,United States,2019,926675,Basic Industries,Industrial Specialties
LFC,China Life Insurance Company Limited American Depositary Shares,$10.35,0.03,0.291%,58507939350.00,China,2003,422069,Finance,Life Insurance
LFT,Lument Finance Trust Inc. Common Stock,$3.71,0.04,1.09%,92539951.00,United States,2013,73614,Consumer Services,Real Estate Investment Trusts
LGI,Lazard Global Total Return and Income Fund Common Stock,$20.40,0.06,0.295%,265397084.00,United States,2004,24746,,
LH,Laboratory Corporation of America Holdings Common Stock,$278.14,0.06,0.022%,27174278000.00,United States,,483890,Health Care,Medical Specialities
LHC,Leo Holdings Corp. II Class A Ordinary Shares,$9.82,-0.02,-0.203%,460312500.00,,2021,3064,Finance,Business Services
LHX,L3Harris Technologies Inc. Common Stock,$219.25,2.26,1.042%,44942702974.00,United States,,1072911,Capital Goods,Industrial Machinery/Components
LII,Lennox International Inc. Common Stock,$348.00,5.72,1.671%,13146275244.00,United States,1999,142574,Capital Goods,Industrial Machinery/Components
LIII,Leo Holdings III Corp. Class A Ordinary Shares,$9.78,0.005,0.051%,0.00,,2021,2832,,
LIN,Linde plc Ordinary Share,$298.93,2.53,0.854%,155452479716.00,,2018,1883642,Basic Industries,Major Chemicals
LINX,Linx S.A. American Depositary Shares each representing one common share,$7.20,0.09,1.266%,1264991206.00,,2019,37925,Technology,Computer Software: Prepackaged Software
LITB,LightInTheBox Holding Co. Ltd. American Depositary Shares each representing 2 ordinary shares,$3.10,-0.12,-3.727%,346504286.00,China,2013,226341,Consumer Services,Catalog/Specialty Distribution
LL,Lumber Liquidators Holdings Inc Common Stock,$24.19,0.29,1.213%,701181330.00,United States,2007,463562,Consumer Services,RETAIL: Building Materials
LLY,Eli Lilly and Company Common Stock,$195.42,1.53,0.789%,187501972440.00,United States,,2526688,Health Care,Major Pharmaceuticals
LMND,Lemonade Inc. Common Stock,$79.11,2.98,3.914%,4855760804.00,United States,2020,1571578,Finance,Property-Casualty Insurers
LMT,Lockheed Martin Corporation Common Stock,$390.34,3.00,0.775%,108488751705.00,United States,,1203262,Capital Goods,Aerospace
LNC,Lincoln National Corporation Common Stock,$69.30,0.70,1.02%,13246636719.00,United States,,1541411,Finance,Life Insurance
LND,Brasilagro Brazilian Agric Real Estate Co Sponsored ADR (Brazil),$6.66,0.06,0.909%,527358281.00,Brazil,,17825,Consumer Non-Durables,Farming/Seeds/Milling
LNFA,L&amp;F Acquisition Corp. Class A Ordinary Shares,$9.95,0.00,0.00%,214541900.00,United States,2021,164,Finance,Business Services
LNN,Lindsay Corporation Common Stock,$171.33,2.40,1.421%,1868626065.00,United States,,26749,Capital Goods,Industrial Machinery/Components
LOKB,Live Oak Acquisition Corp. II Class A Common Stock,$9.93,-0.10,-0.997%,314036250.00,,2021,4012741,,
LOKM,Live Oak Mobility Acquisition Corp. Class A Common Stock,$9.77,0.00,0.00%,308976250.00,,2021,1329,,
LOMA,Loma Negra Compania Industrial Argentina Sociedad Anonima ADS,$5.91,0.13,2.249%,704503311.00,Argentina,2017,115764,Capital Goods,Building Materials
LOW,Lowe's Companies Inc. Common Stock,$208.40,2.46,1.195%,149459973350.00,United States,,3694797,Consumer Services,RETAIL: Building Materials
LPG,Dorian LPG Ltd. Common Stock,$13.89,0.17,1.239%,576182813.00,,2014,280043,Transportation,Marine Transportation
LPI,Laredo Petroleum Inc. Common Stock,$37.22,0.85,2.337%,480125345.00,United States,2011,881470,Energy,Oil & Gas Production
LPL,LG Display Co Ltd AMERICAN DEPOSITORY SHARES,$11.06,0.33,3.075%,7914883284.00,South Korea,2004,656113,Capital Goods,Industrial Machinery/Components
LPX,Louisiana-Pacific Corporation Common Stock,$72.73,3.49,5.04%,7749073634.00,United States,,2758851,,
LRN,Stride Inc. Common Stock,$28.38,0.96,3.501%,1178961449.00,United States,,524272,Miscellaneous,Other Consumer Services
LSI,Life Storage Inc. Common Stock,$95.97,1.34,1.416%,7334391702.00,United States,,499816,Consumer Services,Real Estate Investment Trusts
LSPD,Lightspeed POS Inc. Subordinate Voting Shares,$62.63,1.26,2.053%,8218078998.00,,,812739,,
LTC,LTC Properties Inc. Common Stock,$40.93,0.25,0.615%,1611193978.00,United States,,216778,Consumer Services,Real Estate Investment Trusts
LTHM,Livent Corporation Common Stock,$18.15,0.91,5.278%,2660903238.00,United States,2018,2090158,Basic Industries,Industrial Specialties
